outputs/proj1_rext_refractive_20260502_193707/properties.json

{
  "schema_version": "1.0",
  "render": {
    "name": "proj1_rext_refractive",
    "width": 800,
    "height": 600,
    "samples_per_pixel": 4,
    "sampling_mode": "stratified",
    "seed": null,
    "gamma_fix": false,
    "render_time_seconds": 91.70757187500203,
    "ray_estimation": {
      "primary_rays": 1920000,
      "secondary_rays": 310726,
      "shadow_rays": 2119189,
      "total_rays": 4349915,
      "estimated_time_seconds": 87.33305523421507,
      "estimated_time_minutes": 1.455550920570251,
      "formatted_time": "87.333s (1.456 min)",
      "throughput_rays_per_second": 49808,
      "primary_hit_ratio": 0.475,
      "recursive_surface_ratio": 0.2857142857142857,
      "shadow_samples_per_hit": 2,
      "estimated_intersection_tests": 30449405,
      "measured_intersection_throughput": 348658.4194076223,
      "estimated_time_by_intersections_seconds": 87.33305523421507,
      "estimated_time_by_intersections_minutes": 1.455550920570251,
      "avg_intersections_per_ray": 7.0,
      "calibration": {
        "calibration_elapsed_seconds": 0.0501120839981013,
        "calibration_samples_tested": 1024,
        "calibration_rays_traced": 1280,
        "calibration_intersection_tests": 17472,
        "calibration_shadow_rays": 1216,
        "measured_throughput_rays_per_second": 49808.345629660325
      }
    },
    "estimation_quality": {
      "rays_model_estimated_seconds": 87.33305523421507,
      "rays_model_actual_seconds": 91.70757187500203,
      "rays_model_absolute_error_seconds": 4.374516640786965,
      "rays_model_relative_error": 0.04770071381618801,
      "rays_model_accuracy_percent": 95.2299286183812,
      "rays_model_actual_over_estimated": 1.0500900447036363,
      "intersection_model_estimated_seconds": 87.33305523421507,
      "intersection_model_actual_seconds": 91.70757187500203,
      "intersection_model_absolute_error_seconds": 4.374516640786965,
      "intersection_model_relative_error": 0.04770071381618801,
      "intersection_model_accuracy_percent": 95.2299286183812,
      "intersection_model_actual_over_estimated": 1.0500900447036363
    }
  },
  "scene": {
    "ambient_light": [
      0.029999999329447746,
      0.029999999329447746,
      0.029999999329447746
    ],
    "background_color": [
      0.019999999552965164,
      0.019999999552965164,
      0.05000000074505806
    ],
    "max_depth": 8,
    "ray_epsilon": 0.001
  },
  "camera": {
    "eye": [
      2.7750000953674316,
      3.200000047683716,
      12.774999618530273
    ],
    "center": [
      2.7750000953674316,
      2.7750000953674316,
      2.7750000953674316
    ],
    "up": [
      0.0,
      1.0,
      0.0
    ],
    "fov": 50.0,
    "focal_distance": 1.0,
    "aspect": 1.3333333333333333
  },
  "objects": [
    {
      "type": "Box",
      "material": {
        "type": "PhongMaterial",
        "ambient": [
          0.07999999821186066,
          0.07999999821186066,
          0.07999999821186066
        ],
        "diffuse": [
          0.75,
          0.75,
          0.75
        ],
        "specular": [
          0.0,
          0.0,
          0.0
        ],
        "shininess": 1.0
      },
      "shape_chain": [
        "Box"
      ],
      "p_min": [
        -0.10000000149011612,
        -0.10000000149011612,
        -0.10000000149011612
      ],
      "p_max": [
        5.650000095367432,
        5.650000095367432,
        0.0
      ]
    },
    {
      "type": "Box",
      "material": {
        "type": "PhongMaterial",
        "ambient": [
          0.0,
          0.07999999821186066,
          0.0
        ],
        "diffuse": [
          0.05000000074505806,
          0.75,
          0.05000000074505806
        ],
        "specular": [
          0.0,
          0.0,
          0.0
        ],
        "shininess": 1.0
      },
      "shape_chain": [
        "Box"
      ],
      "p_min": [
        -0.10000000149011612,
        -0.10000000149011612,
        0.0
      ],
      "p_max": [
        0.0,
        5.550000190734863,
        5.550000190734863
      ]
    },
    {
      "type": "Box",
      "material": {
        "type": "PhongMaterial",
        "ambient": [
          0.07999999821186066,
          0.0,
          0.0
        ],
        "diffuse": [
          0.75,
          0.05000000074505806,
          0.05000000074505806
        ],
        "specular": [
          0.0,
          0.0,
          0.0
        ],
        "shininess": 1.0
      },
      "shape_chain": [
        "Box"
      ],
      "p_min": [
        5.550000190734863,
        -0.10000000149011612,
        0.0
      ],
      "p_max": [
        5.650000095367432,
        5.550000190734863,
        5.550000190734863
      ]
    },
    {
      "type": "Box",
      "material": {
        "type": "PhongMaterial",
        "ambient": [
          0.07999999821186066,
          0.07999999821186066,
          0.07999999821186066
        ],
        "diffuse": [
          0.75,
          0.75,
          0.75
        ],
        "specular": [
          0.0,
          0.0,
          0.0
        ],
        "shininess": 1.0
      },
      "shape_chain": [
        "Box"
      ],
      "p_min": [
        0.0,
        5.550000190734863,
        0.0
      ],
      "p_max": [
        5.550000190734863,
        5.650000095367432,
        5.550000190734863
      ]
    },
    {
      "type": "Box",
      "material": {
        "type": "PhongMaterial",
        "ambient": [
          0.07999999821186066,
          0.07999999821186066,
          0.07999999821186066
        ],
        "diffuse": [
          0.75,
          0.75,
          0.75
        ],
        "specular": [
          0.0,
          0.0,
          0.0
        ],
        "shininess": 1.0
      },
      "shape_chain": [
        "Box"
      ],
      "p_min": [
        -0.10000000149011612,
        -0.10000000149011612,
        0.0
      ],
      "p_max": [
        5.650000095367432,
        0.0,
        5.550000190734863
      ]
    },
    {
      "type": "Sphere",
      "material": {
        "type": "TransparentMaterial",
        "ambient": [
          0.0,
          0.0,
          0.0
        ],
        "diffuse": [
          0.0,
          0.0,
          0.0
        ],
        "specular": [
          0.0,
          0.0,
          0.0
        ],
        "shininess": 1.0,
        "attenuation": [
          1.0,
          1.0,
          1.0
        ],
        "ior": 1.5
      },
      "shape_chain": [
        "Sphere"
      ],
      "center": [
        3.950000047683716,
        0.6499999761581421,
        4.099999904632568
      ],
      "radius": 0.65
    },
    {
      "type": "TriangleMesh",
      "material": {
        "type": "TransparentMaterial",
        "ambient": [
          0.0,
          0.0,
          0.0
        ],
        "diffuse": [
          0.0,
          0.0,
          0.0
        ],
        "specular": [
          0.0,
          0.0,
          0.0
        ],
        "shininess": 1.0,
        "attenuation": [
          0.8799999952316284,
          0.9399999976158142,
          0.9800000190734863
        ],
        "ior": 1.5
      },
      "shape_chain": [
        "TriangleMesh"
      ],
      "vertices": [
        [
          0.75,
          0.019999999552965164,
          4.550000190734863
        ],
        [
          1.649999976158142,
          0.019999999552965164,
          4.550000190734863
        ],
        [
          1.649999976158142,
          0.019999999552965164,
          5.449999809265137
        ],
        [
          0.75,
          0.019999999552965164,
          5.449999809265137
        ],
        [
          1.2000000476837158,
          1.2200000286102295,
          5.0
        ]
      ],
      "faces": [
        [
          0,
          1,
          2
        ],
        [
          0,
          2,
          3
        ],
        [
          0,
          1,
          4
        ],
        [
          1,
          2,
          4
        ],
        [
          2,
          3,
          4
        ],
        [
          3,
          0,
          4
        ]
      ],
      "name": "transparent_pyramid",
      "vertex_count": 5,
      "face_count": 6,
      "triangle_count": 6
    }
  ],
  "lights": [
    {
      "type": "PointLight",
      "pos": [
        2.7750000953674316,
        5.400000095367432,
        2.7750000953674316
      ],
      "power": [
        0.8999999761581421,
        0.8999999761581421,
        0.8999999761581421
      ]
    },
    {
      "type": "PointLight",
      "pos": [
        4.550000190734863,
        4.849999904632568,
        4.550000190734863
      ],
      "power": [
        0.30000001192092896,
        0.3199999928474426,
        0.3499999940395355
      ]
    }
  ]
}

outputs/proj1_rext_refractive_20260502_193707/properties.md

## Qualidade da Estimativa

- **Rays Model (estimado)**: 87.333s
- **Rays Model (real)**: 91.708s
- **Rays Model (erro abs)**: 4.375s
- **Rays Model (erro rel)**: 4.770%
- **Rays Model (fator real/estimado)**: 1.05x
- **Rays Model (acurácia)**: 95.23%
- **Intersection Model (estimado)**: 87.333s
- **Intersection Model (real)**: 91.708s
- **Intersection Model (erro abs)**: 4.375s
- **Intersection Model (erro rel)**: 4.770%
- **Intersection Model (fator real/estimado)**: 1.05x
- **Intersection Model (acurácia)**: 95.23%