outputs/proj1_req1_geometry_20260502_191927/properties.json

{
  "schema_version": "1.0",
  "render": {
    "name": "proj1_req1_geometry",
    "width": 800,
    "height": 600,
    "samples_per_pixel": 1,
    "sampling_mode": "jittered",
    "seed": null,
    "gamma_fix": false,
    "render_time_seconds": 10.241786624999804,
    "ray_estimation": {
      "primary_rays": 480000,
      "secondary_rays": 0,
      "shadow_rays": 0,
      "total_rays": 480000,
      "estimated_time_seconds": 11.99351437662699,
      "estimated_time_minutes": 0.1998919062771165,
      "formatted_time": "11.994s (0.200 min)",
      "throughput_rays_per_second": 40021,
      "primary_hit_ratio": 0.05,
      "recursive_surface_ratio": 0.0,
      "shadow_samples_per_hit": 0,
      "estimated_intersection_tests": 3840000,
      "measured_intersection_throughput": 320173.0434811841,
      "estimated_time_by_intersections_seconds": 11.99351437662699,
      "estimated_time_by_intersections_minutes": 0.1998919062771165,
      "avg_intersections_per_ray": 8.0,
      "calibration": {
        "calibration_elapsed_seconds": 0.006396541000867728,
        "calibration_samples_tested": 256,
        "calibration_rays_traced": 256,
        "calibration_intersection_tests": 2048,
        "calibration_shadow_rays": 0,
        "measured_throughput_rays_per_second": 40021.630435148014
      }
    },
    "estimation_quality": {
      "rays_model_estimated_seconds": 11.99351437662699,
      "rays_model_actual_seconds": 10.241786624999804,
      "rays_model_absolute_error_seconds": 1.751727751627186,
      "rays_model_relative_error": 0.17103732149147557,
      "rays_model_accuracy_percent": 82.89626785085244,
      "rays_model_actual_over_estimated": 0.85394374854455,
      "intersection_model_estimated_seconds": 11.99351437662699,
      "intersection_model_actual_seconds": 10.241786624999804,
      "intersection_model_absolute_error_seconds": 1.751727751627186,
      "intersection_model_relative_error": 0.17103732149147557,
      "intersection_model_accuracy_percent": 82.89626785085244,
      "intersection_model_actual_over_estimated": 0.85394374854455
    }
  },
  "scene": {
    "ambient_light": [
      3.0,
      3.0,
      3.0
    ],
    "background_color": [
      0.019999999552965164,
      0.019999999552965164,
      0.05000000074505806
    ],
    "max_depth": 2,
    "ray_epsilon": 0.001
  },
  "camera": {
    "eye": [
      2.7750000953674316,
      3.200000047683716,
      12.774999618530273
    ],
    "center": [
      2.7750000953674316,
      2.7750000953674316,
      2.7750000953674316
    ],
    "up": [
      0.0,
      1.0,
      0.0
    ],
    "fov": 50.0,
    "focal_distance": 1.0,
    "aspect": 1.3333333333333333
  },
  "objects": [
    {
      "type": "Box",
      "material": {
        "type": "PhongMaterial",
        "ambient": [
          0.07999999821186066,
          0.07999999821186066,
          0.07999999821186066
        ],
        "diffuse": [
          0.75,
          0.75,
          0.75
        ],
        "specular": [
          0.0,
          0.0,
          0.0
        ],
        "shininess": 1.0
      },
      "shape_chain": [
        "Box"
      ],
      "p_min": [
        -0.10000000149011612,
        -0.10000000149011612,
        -0.10000000149011612
      ],
      "p_max": [
        5.650000095367432,
        5.650000095367432,
        0.0
      ]
    },
    {
      "type": "Box",
      "material": {
        "type": "PhongMaterial",
        "ambient": [
          0.0,
          0.07999999821186066,
          0.0
        ],
        "diffuse": [
          0.05000000074505806,
          0.75,
          0.05000000074505806
        ],
        "specular": [
          0.0,
          0.0,
          0.0
        ],
        "shininess": 1.0
      },
      "shape_chain": [
        "Box"
      ],
      "p_min": [
        -0.10000000149011612,
        -0.10000000149011612,
        0.0
      ],
      "p_max": [
        0.0,
        5.550000190734863,
        5.550000190734863
      ]
    },
    {
      "type": "Box",
      "material": {
        "type": "PhongMaterial",
        "ambient": [
          0.07999999821186066,
          0.0,
          0.0
        ],
        "diffuse": [
          0.75,
          0.05000000074505806,
          0.05000000074505806
        ],
        "specular": [
          0.0,
          0.0,
          0.0
        ],
        "shininess": 1.0
      },
      "shape_chain": [
        "Box"
      ],
      "p_min": [
        5.550000190734863,
        -0.10000000149011612,
        0.0
      ],
      "p_max": [
        5.650000095367432,
        5.550000190734863,
        5.550000190734863
      ]
    },
    {
      "type": "Box",
      "material": {
        "type": "PhongMaterial",
        "ambient": [
          0.07999999821186066,
          0.07999999821186066,
          0.07999999821186066
        ],
        "diffuse": [
          0.75,
          0.75,
          0.75
        ],
        "specular": [
          0.0,
          0.0,
          0.0
        ],
        "shininess": 1.0
      },
      "shape_chain": [
        "Box"
      ],
      "p_min": [
        0.0,
        5.550000190734863,
        0.0
      ],
      "p_max": [
        5.550000190734863,
        5.650000095367432,
        5.550000190734863
      ]
    },
    {
      "type": "Box",
      "material": {
        "type": "PhongMaterial",
        "ambient": [
          0.07999999821186066,
          0.07999999821186066,
          0.07999999821186066
        ],
        "diffuse": [
          0.75,
          0.75,
          0.75
        ],
        "specular": [
          0.0,
          0.0,
          0.0
        ],
        "shininess": 1.0
      },
      "shape_chain": [
        "Box"
      ],
      "p_min": [
        -0.10000000149011612,
        -0.10000000149011612,
        0.0
      ],
      "p_max": [
        5.650000095367432,
        0.0,
        5.550000190734863
      ]
    },
    {
      "type": "Instance",
      "material": {
        "type": "PhongMaterial",
        "ambient": [
          0.10000000149011612,
          0.10000000149011612,
          0.10000000149011612
        ],
        "diffuse": [
          0.5,
          0.5,
          0.5
        ],
        "specular": [
          0.0,
          0.0,
          0.0
        ],
        "shininess": 1.0
      },
      "shape": {
        "type": "Box",
        "material": {
          "type": "PhongMaterial",
          "ambient": [
            0.10000000149011612,
            0.10000000149011612,
            0.10000000149011612
          ],
          "diffuse": [
            0.5,
            0.5,
            0.5
          ],
          "specular": [
            0.0,
            0.0,
            0.0
          ],
          "shininess": 1.0
        },
        "shape_chain": [
          "Box"
        ],
        "p_min": [
          0.0,
          0.0,
          0.0
        ],
        "p_max": [
          1.649999976158142,
          3.299999952316284,
          1.649999976158142
        ]
      },
      "shape_chain": [
        "Instance",
        "Box"
      ],
      "matrix": [
        [
          0.9238795042037964,
          0.0,
          0.3826834261417389,
          0.6499999761581421
        ],
        [
          0.0,
          1.0,
          0.0,
          0.0
        ],
        [
          -0.3826834261417389,
          0.0,
          0.9238795042037964,
          1.2999999523162842
        ],
        [
          0.0,
          0.0,
          0.0,
          1.0
        ]
      ]
    },
    {
      "type": "Instance",
      "material": {
        "type": "PhongMaterial",
        "ambient": [
          0.10000000149011612,
          0.10000000149011612,
          0.10000000149011612
        ],
        "diffuse": [
          0.5,
          0.5,
          0.5
        ],
        "specular": [
          0.0,
          0.0,
          0.0
        ],
        "shininess": 1.0
      },
      "shape": {
        "type": "Box",
        "material": {
          "type": "PhongMaterial",
          "ambient": [
            0.10000000149011612,
            0.10000000149011612,
            0.10000000149011612
          ],
          "diffuse": [
            0.5,
            0.5,
            0.5
          ],
          "specular": [
            0.0,
            0.0,
            0.0
          ],
          "shininess": 1.0
        },
        "shape_chain": [
          "Box"
        ],
        "p_min": [
          0.0,
          0.0,
          0.0
        ],
        "p_max": [
          1.649999976158142,
          1.649999976158142,
          0.30000001192092896
        ]
      },
      "shape_chain": [
        "Instance",
        "Box"
      ],
      "matrix": [
        [
          0.9510565400123596,
          0.0,
          -0.30901700258255005,
          3.4000000953674316
        ],
        [
          0.0,
          1.0,
          0.0,
          0.0
        ],
        [
          0.30901700258255005,
          0.0,
          0.9510565400123596,
          3.6500000953674316
        ],
        [
          0.0,
          0.0,
          0.0,
          1.0
        ]
      ]
    },
    {
      "type": "Sphere",
      "material": {
        "type": "PhongMaterial",
        "ambient": [
          0.10000000149011612,
          0.10000000149011612,
          0.10000000149011612
        ],
        "diffuse": [
          0.5,
          0.5,
          0.5
        ],
        "specular": [
          0.0,
          0.0,
          0.0
        ],
        "shininess": 1.0
      },
      "shape_chain": [
        "Sphere"
      ],
      "center": [
        3.950000047683716,
        0.6499999761581421,
        4.650000095367432
      ],
      "radius": 0.65
    }
  ],
  "lights": []
}

outputs/proj1_req1_geometry_20260502_191927/properties.md

## Qualidade da Estimativa

- **Rays Model (estimado)**: 11.994s
- **Rays Model (real)**: 10.242s
- **Rays Model (erro abs)**: 1.752s
- **Rays Model (erro rel)**: 17.104%
- **Rays Model (fator real/estimado)**: 0.85x
- **Rays Model (acurácia)**: 82.90%
- **Intersection Model (estimado)**: 11.994s
- **Intersection Model (real)**: 10.242s
- **Intersection Model (erro abs)**: 1.752s
- **Intersection Model (erro rel)**: 17.104%
- **Intersection Model (fator real/estimado)**: 0.85x
- **Intersection Model (acurácia)**: 82.90%