outputs/proj1_req4_sampling_20260506_211923/properties.json

{
  "schema_version": "1.0",
  "render": {
    "name": "proj1_req4_sampling",
    "width": 800,
    "height": 600,
    "samples_per_pixel": 4,
    "sampling_mode": "stratified",
    "seed": 42,
    "gamma_fix": false,
    "render_time_seconds": 84.83859700000903,
    "ray_estimation": {
      "primary_rays": 1920000,
      "secondary_rays": 0,
      "shadow_rays": 1950000,
      "total_rays": 3870000,
      "estimated_time_seconds": 83.11414127092576,
      "estimated_time_minutes": 1.3852356878487626,
      "formatted_time": "83.114s (1.385 min)",
      "throughput_rays_per_second": 46562,
      "primary_hit_ratio": 0.5078125,
      "recursive_surface_ratio": 0.0,
      "shadow_samples_per_hit": 2,
      "estimated_intersection_tests": 34830000,
      "measured_intersection_throughput": 419062.26145638974,
      "estimated_time_by_intersections_seconds": 83.11414127092576,
      "estimated_time_by_intersections_minutes": 1.3852356878487626,
      "avg_intersections_per_ray": 9.0,
      "calibration": {
        "calibration_elapsed_seconds": 0.044327542011160403,
        "calibration_samples_tested": 1024,
        "calibration_rays_traced": 1024,
        "calibration_intersection_tests": 18576,
        "calibration_shadow_rays": 1040,
        "measured_throughput_rays_per_second": 46562.47349515441
      }
    },
    "estimation_quality": {
      "rays_model_estimated_seconds": 83.11414127092576,
      "rays_model_actual_seconds": 84.83859700000903,
      "rays_model_absolute_error_seconds": 1.7244557290832745,
      "rays_model_relative_error": 0.020326311255277958,
      "rays_model_accuracy_percent": 97.9673688744722,
      "rays_model_actual_over_estimated": 1.020748042423516,
      "intersection_model_estimated_seconds": 83.11414127092576,
      "intersection_model_actual_seconds": 84.83859700000903,
      "intersection_model_absolute_error_seconds": 1.7244557290832745,
      "intersection_model_relative_error": 0.020326311255277958,
      "intersection_model_accuracy_percent": 97.9673688744722,
      "intersection_model_actual_over_estimated": 1.020748042423516
    }
  },
  "scene": {
    "ambient_light": [
      0.014999999664723873,
      0.014999999664723873,
      0.014999999664723873
    ],
    "background_color": [
      0.019999999552965164,
      0.019999999552965164,
      0.05000000074505806
    ],
    "max_depth": 2,
    "ray_epsilon": 0.001
  },
  "camera": {
    "eye": [
      2.7750000953674316,
      3.200000047683716,
      12.774999618530273
    ],
    "center": [
      2.7750000953674316,
      2.7750000953674316,
      2.7750000953674316
    ],
    "up": [
      0.0,
      1.0,
      0.0
    ],
    "fov": 50.0,
    "focal_distance": 1.0,
    "aspect": 1.3333333333333333
  },
  "objects": [
    {
      "type": "Box",
      "material": {
        "type": "PhongMaterial",
        "ambient": [
          0.07999999821186066,
          0.07999999821186066,
          0.07999999821186066
        ],
        "diffuse": [
          0.75,
          0.75,
          0.75
        ],
        "specular": [
          0.0,
          0.0,
          0.0
        ],
        "shininess": 1.0
      },
      "shape_chain": [
        "Box"
      ],
      "p_min": [
        -0.10000000149011612,
        -0.10000000149011612,
        -0.10000000149011612
      ],
      "p_max": [
        5.650000095367432,
        5.650000095367432,
        0.0
      ]
    },
    {
      "type": "Box",
      "material": {
        "type": "PhongMaterial",
        "ambient": [
          0.0,
          0.07999999821186066,
          0.0
        ],
        "diffuse": [
          0.05000000074505806,
          0.75,
          0.05000000074505806
        ],
        "specular": [
          0.0,
          0.0,
          0.0
        ],
        "shininess": 1.0
      },
      "shape_chain": [
        "Box"
      ],
      "p_min": [
        -0.10000000149011612,
        -0.10000000149011612,
        0.0
      ],
      "p_max": [
        0.0,
        5.550000190734863,
        5.550000190734863
      ]
    },
    {
      "type": "Box",
      "material": {
        "type": "PhongMaterial",
        "ambient": [
          0.07999999821186066,
          0.0,
          0.0
        ],
        "diffuse": [
          0.75,
          0.05000000074505806,
          0.05000000074505806
        ],
        "specular": [
          0.0,
          0.0,
          0.0
        ],
        "shininess": 1.0
      },
      "shape_chain": [
        "Box"
      ],
      "p_min": [
        5.550000190734863,
        -0.10000000149011612,
        0.0
      ],
      "p_max": [
        5.650000095367432,
        5.550000190734863,
        5.550000190734863
      ]
    },
    {
      "type": "Box",
      "material": {
        "type": "PhongMaterial",
        "ambient": [
          0.07999999821186066,
          0.07999999821186066,
          0.07999999821186066
        ],
        "diffuse": [
          0.75,
          0.75,
          0.75
        ],
        "specular": [
          0.0,
          0.0,
          0.0
        ],
        "shininess": 1.0
      },
      "shape_chain": [
        "Box"
      ],
      "p_min": [
        0.0,
        5.550000190734863,
        0.0
      ],
      "p_max": [
        5.550000190734863,
        5.650000095367432,
        5.550000190734863
      ]
    },
    {
      "type": "Box",
      "material": {
        "type": "PhongMaterial",
        "ambient": [
          0.07999999821186066,
          0.07999999821186066,
          0.07999999821186066
        ],
        "diffuse": [
          0.75,
          0.75,
          0.75
        ],
        "specular": [
          0.0,
          0.0,
          0.0
        ],
        "shininess": 1.0
      },
      "shape_chain": [
        "Box"
      ],
      "p_min": [
        -0.10000000149011612,
        -0.10000000149011612,
        0.0
      ],
      "p_max": [
        5.650000095367432,
        0.0,
        5.550000190734863
      ]
    },
    {
      "type": "Instance",
      "material": {
        "type": "PhongMaterial",
        "ambient": [
          0.0,
          0.0,
          0.0
        ],
        "diffuse": [
          0.029999999329447746,
          0.029999999329447746,
          0.029999999329447746
        ],
        "specular": [
          0.0,
          0.0,
          0.0
        ],
        "shininess": 1.0
      },
      "shape": {
        "type": "Box",
        "material": {
          "type": "PhongMaterial",
          "ambient": [
            0.0,
            0.0,
            0.0
          ],
          "diffuse": [
            0.029999999329447746,
            0.029999999329447746,
            0.029999999329447746
          ],
          "specular": [
            0.0,
            0.0,
            0.0
          ],
          "shininess": 1.0
        },
        "shape_chain": [
          "Box"
        ],
        "p_min": [
          0.0,
          0.0,
          0.0
        ],
        "p_max": [
          2.799999952316284,
          0.949999988079071,
          0.11999999731779099
        ]
      },
      "shape_chain": [
        "Instance",
        "Box"
      ],
      "matrix": [
        [
          0.9135454297065735,
          0.0,
          -0.4067366421222687,
          1.0499999523162842
        ],
        [
          0.0,
          1.0,
          0.0,
          0.0
        ],
        [
          0.4067366421222687,
          0.0,
          0.9135454297065735,
          2.6500000953674316
        ],
        [
          0.0,
          0.0,
          0.0,
          1.0
        ]
      ]
    },
    {
      "type": "Instance",
      "material": {
        "type": "PhongMaterial",
        "ambient": [
          0.019999999552965164,
          0.019999999552965164,
          0.019999999552965164
        ],
        "diffuse": [
          0.8500000238418579,
          0.8500000238418579,
          0.8500000238418579
        ],
        "specular": [
          0.019999999552965164,
          0.019999999552965164,
          0.019999999552965164
        ],
        "shininess": 8.0
      },
      "shape": {
        "type": "Box",
        "material": {
          "type": "PhongMaterial",
          "ambient": [
            0.019999999552965164,
            0.019999999552965164,
            0.019999999552965164
          ],
          "diffuse": [
            0.8500000238418579,
            0.8500000238418579,
            0.8500000238418579
          ],
          "specular": [
            0.019999999552965164,
            0.019999999552965164,
            0.019999999552965164
          ],
          "shininess": 8.0
        },
        "shape_chain": [
          "Box"
        ],
        "p_min": [
          0.0,
          0.0,
          0.0
        ],
        "p_max": [
          0.550000011920929,
          2.5999999046325684,
          0.550000011920929
        ]
      },
      "shape_chain": [
        "Instance",
        "Box"
      ],
      "matrix": [
        [
          0.9876883625984192,
          0.0,
          0.15643446147441864,
          3.75
        ],
        [
          0.0,
          1.0,
          0.0,
          0.0
        ],
        [
          -0.15643446147441864,
          0.0,
          0.9876883625984192,
          1.850000023841858
        ],
        [
          0.0,
          0.0,
          0.0,
          1.0
        ]
      ]
    },
    {
      "type": "Sphere",
      "material": {
        "type": "PhongMaterial",
        "ambient": [
          0.019999999552965164,
          0.019999999552965164,
          0.019999999552965164
        ],
        "diffuse": [
          0.8500000238418579,
          0.8500000238418579,
          0.8500000238418579
        ],
        "specular": [
          0.019999999552965164,
          0.019999999552965164,
          0.019999999552965164
        ],
        "shininess": 8.0
      },
      "shape_chain": [
        "Sphere"
      ],
      "center": [
        2.049999952316284,
        0.44999998807907104,
        4.349999904632568
      ],
      "radius": 0.45
    },
    {
      "type": "Sphere",
      "material": {
        "type": "PhongMaterial",
        "ambient": [
          0.0,
          0.0,
          0.0
        ],
        "diffuse": [
          0.029999999329447746,
          0.029999999329447746,
          0.029999999329447746
        ],
        "specular": [
          0.0,
          0.0,
          0.0
        ],
        "shininess": 1.0
      },
      "shape_chain": [
        "Sphere"
      ],
      "center": [
        2.75,
        0.44999998807907104,
        4.75
      ],
      "radius": 0.45
    }
  ],
  "lights": [
    {
      "type": "PointLight",
      "pos": [
        2.75,
        5.449999809265137,
        2.75
      ],
      "power": [
        0.8500000238418579,
        0.8500000238418579,
        0.8500000238418579
      ]
    },
    {
      "type": "PointLight",
      "pos": [
        4.75,
        4.349999904632568,
        4.550000190734863
      ],
      "power": [
        0.20000000298023224,
        0.20000000298023224,
        0.20000000298023224
      ]
    }
  ]
}

outputs/proj1_req4_sampling_20260506_211923/properties.md

## Qualidade da Estimativa

- **Rays Model (estimado)**: 83.114s
- **Rays Model (real)**: 84.839s
- **Rays Model (erro abs)**: 1.724s
- **Rays Model (erro rel)**: 2.033%
- **Rays Model (fator real/estimado)**: 1.02x
- **Rays Model (acurácia)**: 97.97%
- **Intersection Model (estimado)**: 83.114s
- **Intersection Model (real)**: 84.839s
- **Intersection Model (erro abs)**: 1.724s
- **Intersection Model (erro rel)**: 2.033%
- **Intersection Model (fator real/estimado)**: 1.02x
- **Intersection Model (acurácia)**: 97.97%

### Objeto 9: Sphere

- **shape_chain**: ['Sphere']
- **center**: [2.75, 0.44999998807907104, 4.75]
- **radius**: 0.45
- **material**:
  - **type**: PhongMaterial
  - **ambient**: [0.0, 0.0, 0.0]
  - **diffuse**: [0.029999999329447746, 0.029999999329447746, 0.029999999329447746]
  - **specular**: [0.0, 0.0, 0.0]
  - **shininess**: 1.0