out/proj2/req5/proj2_req5_mis_no_rr_20260607_153507/properties.json

{
  "schema_version": "1.0",
  "render": {
    "name": "proj2_req5_mis_no_rr",
    "width": 512,
    "height": 512,
    "samples_per_pixel": 12,
    "sampling_mode": "jittered",
    "seed": null,
    "gamma_fix": false,
    "integrator_mode": "mis",
    "command_line": "/Users/yang/projects/INF2608-comp-grafica/src/path_tracing/scripts/proj2_req5_rr.py --spp 12 --depth 8 --mode mis --use-rr 4",
    "render_time_seconds": 452.686651416996,
    "ray_estimation": {
      "path_tracing_mode": true,
      "primary_rays": 3145728,
      "secondary_rays": 15728640,
      "shadow_rays": 13212057,
      "total_rays": 3145728,
      "estimated_time_seconds": 343.47336602211004,
      "estimated_time_minutes": 5.724556100368501,
      "formatted_time": "343.473s (5.725 min)",
      "throughput_rays_per_second": 9158,
      "primary_hit_ratio": 0.7,
      "recursive_surface_ratio": 0.8888888888888888,
      "shadow_samples_per_hit": 1,
      "estimated_intersection_tests": 28311552,
      "measured_intersection_throughput": 385518.94003762776,
      "estimated_time_by_intersections_seconds": 73.43751255706583,
      "estimated_time_by_intersections_minutes": 1.223958542617764,
      "calibration": {
        "calibration_mode": "integrator_Li",
        "calibration_elapsed_seconds": 0.3354232090059668,
        "calibration_samples_tested": 3072,
        "calibration_rays_traced": 0,
        "calibration_intersection_tests": 129312,
        "calibration_shadow_rays": 0,
        "measured_throughput_rays_per_second": 9158.579124873117
      }
    },
    "estimation_quality": {
      "rays_model_estimated_seconds": 343.47336602211004,
      "rays_model_actual_seconds": 452.686651416996,
      "rays_model_absolute_error_seconds": 109.21328539488599,
      "rays_model_relative_error": 0.2412558113941011,
      "rays_model_accuracy_percent": 75.87441886058988,
      "rays_model_actual_over_estimated": 1.3179672609254243,
      "intersection_model_estimated_seconds": 73.43751255706583,
      "intersection_model_actual_seconds": 452.686651416996,
      "intersection_model_absolute_error_seconds": 379.2491388599302,
      "intersection_model_relative_error": 0.8377740710330372,
      "intersection_model_accuracy_percent": 16.222592896696277,
      "intersection_model_actual_over_estimated": 6.164242709953287
    }
  },
  "scene": {
    "ambient_light": [
      0.0,
      0.0,
      0.0
    ],
    "background_color": [
      0.0,
      0.0,
      0.0
    ],
    "max_depth": 8,
    "ray_epsilon": 0.001
  },
  "camera": {
    "eye": [
      2.7750000953674316,
      3.200000047683716,
      12.774999618530273
    ],
    "center": [
      2.7750000953674316,
      2.7750000953674316,
      2.7750000953674316
    ],
    "up": [
      0.0,
      1.0,
      0.0
    ],
    "fov": 50.0,
    "focal_distance": 1.0,
    "aspect": 1.0
  },
  "objects": [
    {
      "type": "Box",
      "material": {
        "type": "LambertianBSDF",
        "albedo": [
          0.7300000190734863,
          0.7300000190734863,
          0.7300000190734863
        ]
      },
      "shape_chain": [
        "Box"
      ],
      "p_min": [
        -0.10000000149011612,
        -0.10000000149011612,
        -0.10000000149011612
      ],
      "p_max": [
        5.650000095367432,
        5.650000095367432,
        0.0
      ]
    },
    {
      "type": "Box",
      "material": {
        "type": "LambertianBSDF",
        "albedo": [
          0.11999999731779099,
          0.44999998807907104,
          0.15000000596046448
        ]
      },
      "shape_chain": [
        "Box"
      ],
      "p_min": [
        -0.10000000149011612,
        -0.10000000149011612,
        0.0
      ],
      "p_max": [
        0.0,
        5.550000190734863,
        5.550000190734863
      ]
    },
    {
      "type": "Box",
      "material": {
        "type": "LambertianBSDF",
        "albedo": [
          0.6499999761581421,
          0.05000000074505806,
          0.05000000074505806
        ]
      },
      "shape_chain": [
        "Box"
      ],
      "p_min": [
        5.550000190734863,
        -0.10000000149011612,
        0.0
      ],
      "p_max": [
        5.650000095367432,
        5.550000190734863,
        5.550000190734863
      ]
    },
    {
      "type": "Box",
      "material": {
        "type": "LambertianBSDF",
        "albedo": [
          0.7300000190734863,
          0.7300000190734863,
          0.7300000190734863
        ]
      },
      "shape_chain": [
        "Box"
      ],
      "p_min": [
        0.0,
        5.550000190734863,
        0.0
      ],
      "p_max": [
        5.550000190734863,
        5.650000095367432,
        5.550000190734863
      ]
    },
    {
      "type": "Box",
      "material": {
        "type": "LambertianBSDF",
        "albedo": [
          0.7300000190734863,
          0.7300000190734863,
          0.7300000190734863
        ]
      },
      "shape_chain": [
        "Box"
      ],
      "p_min": [
        -0.10000000149011612,
        -0.10000000149011612,
        0.0
      ],
      "p_max": [
        5.650000095367432,
        0.0,
        5.550000190734863
      ]
    },
    {
      "type": "Box",
      "material": {
        "type": "EmissiveBSDF",
        "emission": [
          7.0,
          7.0,
          7.0
        ]
      },
      "shape_chain": [
        "Box"
      ],
      "p_min": [
        1.274999976158142,
        5.448999881744385,
        1.274999976158142
      ],
      "p_max": [
        4.275000095367432,
        5.550000190734863,
        4.275000095367432
      ]
    },
    {
      "type": "Box",
      "material": {
        "type": "LambertianBSDF",
        "albedo": [
          0.7300000190734863,
          0.7300000190734863,
          0.7300000190734863
        ]
      },
      "shape_chain": [
        "Box"
      ],
      "p_min": [
        0.8500000238418579,
        0.0,
        0.8500000238418579
      ],
      "p_max": [
        2.5,
        1.100000023841858,
        2.5
      ]
    },
    {
      "type": "Box",
      "material": {
        "type": "LambertianBSDF",
        "albedo": [
          0.7300000190734863,
          0.7300000190734863,
          0.7300000190734863
        ]
      },
      "shape_chain": [
        "Box"
      ],
      "p_min": [
        3.0,
        0.0,
        2.799999952316284
      ],
      "p_max": [
        4.099999904632568,
        2.299999952316284,
        3.9000000953674316
      ]
    },
    {
      "type": "Sphere",
      "material": {
        "type": "LambertianBSDF",
        "albedo": [
          0.7300000190734863,
          0.7300000190734863,
          0.7300000190734863
        ]
      },
      "shape_chain": [
        "Sphere"
      ],
      "center": [
        2.0999999046325684,
        0.6200000047683716,
        4.25
      ],
      "radius": 0.62
    }
  ],
  "lights": [
    {
      "type": "RectAreaLight",
      "corner": [
        1.274999976158142,
        5.449999809265137,
        1.274999976158142
      ],
      "edge_u": [
        3.0,
        0.0,
        0.0
      ],
      "edge_v": [
        0.0,
        0.0,
        3.0
      ],
      "Le": [
        7.0,
        7.0,
        7.0
      ]
    }
  ]
}

out/proj2/req5/proj2_req5_mis_no_rr_20260607_153507/properties.md

### Calibração (rápida)

- **elapsed_seconds**: 0.335
- **samples_tested**: 3,072
- **rays_traced**: 0
- **intersection_tests**: 129,312
- **shadow_rays**: 0
- **measured_throughput**: 9159 caminhos/segundo

## Qualidade da Estimativa

- **Rays Model (estimado)**: 343.473s
- **Rays Model (real)**: 452.687s
- **Rays Model (erro abs)**: 109.213s
- **Rays Model (erro rel)**: 24.126%
- **Rays Model (fator real/estimado)**: 1.32x
- **Rays Model (acurácia)**: 75.87%
- **Intersection Model (estimado)**: 73.438s
- **Intersection Model (real)**: 452.687s
- **Intersection Model (erro abs)**: 379.249s
- **Intersection Model (erro rel)**: 83.777%
- **Intersection Model (fator real/estimado)**: 6.16x
- **Intersection Model (acurácia)**: 16.22%