out/proj2/showcase/proj2_showcase_nee_only_no_rr_20260606_225600/properties.json

{
  "schema_version": "1.0",
  "render": {
    "name": "proj2_showcase_nee_only_no_rr",
    "width": 512,
    "height": 512,
    "samples_per_pixel": 16,
    "sampling_mode": "jittered",
    "seed": null,
    "gamma_fix": false,
    "render_time_seconds": 705.0235005419818,
    "ray_estimation": {
      "path_tracing_mode": true,
      "primary_rays": 4194304,
      "secondary_rays": 20971520,
      "shadow_rays": 17616076,
      "total_rays": 4194304,
      "estimated_time_seconds": 603.5658670067787,
      "estimated_time_minutes": 10.059431116779646,
      "formatted_time": "603.566s (10.059 min)",
      "throughput_rays_per_second": 6949,
      "primary_hit_ratio": 0.7,
      "recursive_surface_ratio": 0.9090909090909091,
      "shadow_samples_per_hit": 1,
      "estimated_intersection_tests": 46137344,
      "measured_intersection_throughput": 328626.5623065334,
      "estimated_time_by_intersections_seconds": 140.39444552557018,
      "estimated_time_by_intersections_minutes": 2.3399074254261696,
      "calibration": {
        "calibration_mode": "integrator_Li",
        "calibration_elapsed_seconds": 0.5894197919988073,
        "calibration_samples_tested": 4096,
        "calibration_rays_traced": 0,
        "calibration_intersection_tests": 193699,
        "calibration_shadow_rays": 0,
        "measured_throughput_rays_per_second": 6949.206754849331
      }
    },
    "estimation_quality": {
      "rays_model_estimated_seconds": 603.5658670067787,
      "rays_model_actual_seconds": 705.0235005419818,
      "rays_model_absolute_error_seconds": 101.45763353520306,
      "rays_model_relative_error": 0.14390673992740416,
      "rays_model_accuracy_percent": 85.6093260072596,
      "rays_model_actual_over_estimated": 1.1680970364317562,
      "intersection_model_estimated_seconds": 140.39444552557018,
      "intersection_model_actual_seconds": 705.0235005419818,
      "intersection_model_absolute_error_seconds": 564.6290550164116,
      "intersection_model_relative_error": 0.8008655804839938,
      "intersection_model_accuracy_percent": 19.913441951600618,
      "intersection_model_actual_over_estimated": 5.021733572882519
    }
  },
  "scene": {
    "ambient_light": [
      0.0,
      0.0,
      0.0
    ],
    "background_color": [
      0.0,
      0.0,
      0.0
    ],
    "max_depth": 8,
    "ray_epsilon": 0.001
  },
  "camera": {
    "eye": [
      2.7750000953674316,
      3.200000047683716,
      12.774999618530273
    ],
    "center": [
      2.7750000953674316,
      2.7750000953674316,
      2.7750000953674316
    ],
    "up": [
      0.0,
      1.0,
      0.0
    ],
    "fov": 50.0,
    "focal_distance": 1.0,
    "aspect": 1.0
  },
  "objects": [
    {
      "type": "Box",
      "material": {
        "type": "LambertianBSDF"
      },
      "shape_chain": [
        "Box"
      ],
      "p_min": [
        -0.10000000149011612,
        -0.10000000149011612,
        -0.10000000149011612
      ],
      "p_max": [
        5.650000095367432,
        5.650000095367432,
        0.0
      ]
    },
    {
      "type": "Box",
      "material": {
        "type": "LambertianBSDF"
      },
      "shape_chain": [
        "Box"
      ],
      "p_min": [
        -0.10000000149011612,
        -0.10000000149011612,
        0.0
      ],
      "p_max": [
        0.0,
        5.550000190734863,
        5.550000190734863
      ]
    },
    {
      "type": "Box",
      "material": {
        "type": "LambertianBSDF"
      },
      "shape_chain": [
        "Box"
      ],
      "p_min": [
        5.550000190734863,
        -0.10000000149011612,
        0.0
      ],
      "p_max": [
        5.650000095367432,
        5.550000190734863,
        5.550000190734863
      ]
    },
    {
      "type": "Box",
      "material": {
        "type": "LambertianBSDF"
      },
      "shape_chain": [
        "Box"
      ],
      "p_min": [
        0.0,
        5.550000190734863,
        0.0
      ],
      "p_max": [
        5.550000190734863,
        5.650000095367432,
        5.550000190734863
      ]
    },
    {
      "type": "Box",
      "material": {
        "type": "LambertianBSDF"
      },
      "shape_chain": [
        "Box"
      ],
      "p_min": [
        -0.10000000149011612,
        -0.10000000149011612,
        0.0
      ],
      "p_max": [
        5.650000095367432,
        0.0,
        5.550000190734863
      ]
    },
    {
      "type": "TriangleMesh",
      "material": {
        "type": "EmissiveBSDF"
      },
      "shape_chain": [
        "TriangleMesh"
      ],
      "vertices": [
        [
          3.375,
          4.900000095367432,
          2.7750000953674316
        ],
        [
          2.1750001907348633,
          4.900000095367432,
          2.7750000953674316
        ],
        [
          2.7750000953674316,
          5.5,
          2.7750000953674316
        ],
        [
          2.7750000953674316,
          4.300000190734863,
          2.7750000953674316
        ],
        [
          2.7750000953674316,
          4.900000095367432,
          3.375
        ],
        [
          2.7750000953674316,
          4.900000095367432,
          2.1750001907348633
        ]
      ],
      "faces": [
        [
          2,
          4,
          0
        ],
        [
          2,
          1,
          4
        ],
        [
          2,
          5,
          1
        ],
        [
          2,
          0,
          5
        ],
        [
          3,
          0,
          4
        ],
        [
          3,
          4,
          1
        ],
        [
          3,
          1,
          5
        ],
        [
          3,
          5,
          0
        ]
      ],
      "name": "octahedron_light",
      "vertex_count": 6,
      "face_count": 8,
      "triangle_count": 8
    },
    {
      "type": "Instance",
      "material": {
        "type": "LambertianBSDF"
      },
      "shape": {
        "type": "Box",
        "material": {
          "type": "LambertianBSDF"
        },
        "shape_chain": [
          "Box"
        ],
        "p_min": [
          0.0,
          0.0,
          0.0
        ],
        "p_max": [
          1.649999976158142,
          3.299999952316284,
          1.649999976158142
        ]
      },
      "shape_chain": [
        "Instance",
        "Box"
      ],
      "matrix": [
        [
          0.9510565400123596,
          0.0,
          0.30901700258255005,
          0.550000011920929
        ],
        [
          0.0,
          1.0,
          0.0,
          0.0
        ],
        [
          -0.30901700258255005,
          0.0,
          0.9510565400123596,
          0.699999988079071
        ],
        [
          0.0,
          0.0,
          0.0,
          1.0
        ]
      ]
    },
    {
      "type": "Instance",
      "material": {
        "type": "LambertianBSDF"
      },
      "shape": {
        "type": "Box",
        "material": {
          "type": "LambertianBSDF"
        },
        "shape_chain": [
          "Box"
        ],
        "p_min": [
          0.0,
          0.0,
          0.0
        ],
        "p_max": [
          1.649999976158142,
          1.100000023841858,
          1.649999976158142
        ]
      },
      "shape_chain": [
        "Instance",
        "Box"
      ],
      "matrix": [
        [
          0.9396926164627075,
          0.0,
          -0.3420201539993286,
          3.299999952316284
        ],
        [
          0.0,
          1.0,
          0.0,
          0.0
        ],
        [
          0.3420201539993286,
          0.0,
          0.9396926164627075,
          0.699999988079071
        ],
        [
          0.0,
          0.0,
          0.0,
          1.0
        ]
      ]
    },
    {
      "type": "Sphere",
      "material": {
        "type": "DielectricBSDF",
        "ior": 1.5
      },
      "shape_chain": [
        "Sphere"
      ],
      "center": [
        1.5,
        0.800000011920929,
        3.4000000953674316
      ],
      "radius": 0.8
    },
    {
      "type": "Sphere",
      "material": {
        "type": "DielectricBSDF",
        "ior": 1.5
      },
      "shape_chain": [
        "Sphere"
      ],
      "center": [
        3.9000000953674316,
        0.800000011920929,
        3.5999999046325684
      ],
      "radius": 0.8
    },
    {
      "type": "Sphere",
      "material": {
        "type": "LambertianBSDF"
      },
      "shape_chain": [
        "Sphere"
      ],
      "center": [
        2.700000047683716,
        0.550000011920929,
        4.699999809265137
      ],
      "radius": 0.55
    }
  ],
  "lights": [
    {
      "type": "TriangleMeshLight"
    }
  ]
}

out/proj2/showcase/proj2_showcase_nee_only_no_rr_20260606_225600/properties.md

### Calibração (rápida)

- **elapsed_seconds**: 0.589
- **samples_tested**: 4,096
- **rays_traced**: 0
- **intersection_tests**: 193,699
- **shadow_rays**: 0
- **measured_throughput**: 6949 raios/segundo

## Qualidade da Estimativa

- **Rays Model (estimado)**: 603.566s
- **Rays Model (real)**: 705.024s
- **Rays Model (erro abs)**: 101.458s
- **Rays Model (erro rel)**: 14.391%
- **Rays Model (fator real/estimado)**: 1.17x
- **Rays Model (acurácia)**: 85.61%
- **Intersection Model (estimado)**: 140.394s
- **Intersection Model (real)**: 705.024s
- **Intersection Model (erro abs)**: 564.629s
- **Intersection Model (erro rel)**: 80.087%
- **Intersection Model (fator real/estimado)**: 5.02x
- **Intersection Model (acurácia)**: 19.91%