out/proj2/req7_dielectric_showcase/proj2_req7_dielectric_showcase_mis_no_rr_20260628_144335/properties.json

{
  "schema_version": "1.0",
  "render": {
    "name": "proj2_req7_dielectric_showcase_mis_no_rr",
    "width": 512,
    "height": 512,
    "samples_per_pixel": 32,
    "sampling_mode": "jittered",
    "seed": null,
    "gamma_fix": false,
    "integrator_mode": "mis",
    "command_line": "/Users/yang/projects/INF2608-comp-grafica/src/path_tracing/scripts/proj2_req7_dielectric_showcase.py --spp 32 --depth 8 --use-rr 8",
    "render_time_seconds": 1013.4420723750009,
    "ray_estimation": {
      "path_tracing_mode": true,
      "primary_rays": 8388608,
      "secondary_rays": 41943040,
      "shadow_rays": 35232153,
      "total_rays": 8388608,
      "estimated_time_seconds": 842.5494179837406,
      "estimated_time_minutes": 14.042490299729009,
      "formatted_time": "842.549s (14.042 min)",
      "throughput_rays_per_second": 9956,
      "primary_hit_ratio": 0.7,
      "recursive_surface_ratio": 0.9,
      "shadow_samples_per_hit": 1,
      "estimated_intersection_tests": 83886080,
      "measured_intersection_throughput": 470161.62084352016,
      "estimated_time_by_intersections_seconds": 178.41966736778602,
      "estimated_time_by_intersections_minutes": 2.973661122796434,
      "calibration": {
        "calibration_mode": "integrator_Li",
        "calibration_elapsed_seconds": 0.8228021659997466,
        "calibration_samples_tested": 8192,
        "calibration_rays_traced": 0,
        "calibration_intersection_tests": 386850,
        "calibration_shadow_rays": 0,
        "measured_throughput_rays_per_second": 9956.2207521006
      }
    },
    "estimation_quality": {
      "rays_model_estimated_seconds": 842.5494179837406,
      "rays_model_actual_seconds": 1013.4420723750009,
      "rays_model_absolute_error_seconds": 170.8926543912603,
      "rays_model_relative_error": 0.16862597187303804,
      "rays_model_accuracy_percent": 83.1374028126962,
      "rays_model_actual_over_estimated": 1.2028280487098482,
      "intersection_model_estimated_seconds": 178.41966736778602,
      "intersection_model_actual_seconds": 1013.4420723750009,
      "intersection_model_absolute_error_seconds": 835.0224050072148,
      "intersection_model_relative_error": 0.823946851792269,
      "intersection_model_accuracy_percent": 17.6053148207731,
      "intersection_model_actual_over_estimated": 5.6801029131275
    }
  },
  "scene": {
    "ambient_light": [
      0.0,
      0.0,
      0.0
    ],
    "background_color": [
      0.0,
      0.0,
      0.0
    ],
    "max_depth": 8,
    "ray_epsilon": 0.001
  },
  "camera": {
    "eye": [
      2.7750000953674316,
      3.200000047683716,
      12.774999618530273
    ],
    "center": [
      2.7750000953674316,
      2.7750000953674316,
      2.7750000953674316
    ],
    "up": [
      0.0,
      1.0,
      0.0
    ],
    "fov": 50.0,
    "focal_distance": 1.0,
    "aspect": 1.0
  },
  "objects": [
    {
      "type": "Box",
      "material": {
        "type": "LambertianBSDF",
        "albedo": [
          0.7300000190734863,
          0.7300000190734863,
          0.7300000190734863
        ]
      },
      "shape_chain": [
        "Box"
      ],
      "p_min": [
        -0.10000000149011612,
        -0.10000000149011612,
        -0.10000000149011612
      ],
      "p_max": [
        5.650000095367432,
        5.650000095367432,
        0.0
      ]
    },
    {
      "type": "Box",
      "material": {
        "type": "LambertianBSDF",
        "albedo": [
          0.11999999731779099,
          0.44999998807907104,
          0.15000000596046448
        ]
      },
      "shape_chain": [
        "Box"
      ],
      "p_min": [
        -0.10000000149011612,
        -0.10000000149011612,
        0.0
      ],
      "p_max": [
        0.0,
        5.550000190734863,
        5.550000190734863
      ]
    },
    {
      "type": "Box",
      "material": {
        "type": "LambertianBSDF",
        "albedo": [
          0.6499999761581421,
          0.05000000074505806,
          0.05000000074505806
        ]
      },
      "shape_chain": [
        "Box"
      ],
      "p_min": [
        5.550000190734863,
        -0.10000000149011612,
        0.0
      ],
      "p_max": [
        5.650000095367432,
        5.550000190734863,
        5.550000190734863
      ]
    },
    {
      "type": "Box",
      "material": {
        "type": "LambertianBSDF",
        "albedo": [
          0.7300000190734863,
          0.7300000190734863,
          0.7300000190734863
        ]
      },
      "shape_chain": [
        "Box"
      ],
      "p_min": [
        0.0,
        5.550000190734863,
        0.0
      ],
      "p_max": [
        5.550000190734863,
        5.650000095367432,
        5.550000190734863
      ]
    },
    {
      "type": "Box",
      "material": {
        "type": "LambertianBSDF",
        "albedo": [
          0.7300000190734863,
          0.7300000190734863,
          0.7300000190734863
        ]
      },
      "shape_chain": [
        "Box"
      ],
      "p_min": [
        -0.10000000149011612,
        -0.10000000149011612,
        0.0
      ],
      "p_max": [
        5.650000095367432,
        0.0,
        5.550000190734863
      ]
    },
    {
      "type": "Box",
      "material": {
        "type": "EmissiveBSDF",
        "emission": [
          7.0,
          7.0,
          7.0
        ]
      },
      "shape_chain": [
        "Box"
      ],
      "p_min": [
        1.274999976158142,
        5.448999881744385,
        1.274999976158142
      ],
      "p_max": [
        4.275000095367432,
        5.550000190734863,
        4.275000095367432
      ]
    },
    {
      "type": "Sphere",
      "material": {
        "type": "DielectricBSDF",
        "attenuation": [
          0.0,
          0.0,
          0.0
        ],
        "ior": 1.5
      },
      "shape_chain": [
        "Sphere"
      ],
      "center": [
        1.399999976158142,
        0.75,
        1.5
      ],
      "radius": 0.75
    },
    {
      "type": "Sphere",
      "material": {
        "type": "DielectricBSDF",
        "attenuation": [
          0.20000000298023224,
          0.6000000238418579,
          1.2000000476837158
        ],
        "ior": 1.5
      },
      "shape_chain": [
        "Sphere"
      ],
      "center": [
        4.150000095367432,
        0.75,
        1.5
      ],
      "radius": 0.75
    },
    {
      "type": "Sphere",
      "material": {
        "type": "DielectricBSDF",
        "attenuation": [
          0.0,
          0.0,
          0.0
        ],
        "ior": 1.33
      },
      "shape_chain": [
        "Sphere"
      ],
      "center": [
        1.399999976158142,
        0.75,
        3.9000000953674316
      ],
      "radius": 0.75
    },
    {
      "type": "Sphere",
      "material": {
        "type": "DielectricBSDF",
        "attenuation": [
          0.30000001192092896,
          0.05000000074505806,
          0.10000000149011612
        ],
        "ior": 1.33
      },
      "shape_chain": [
        "Sphere"
      ],
      "center": [
        4.150000095367432,
        0.75,
        3.9000000953674316
      ],
      "radius": 0.75
    }
  ],
  "lights": [
    {
      "type": "RectAreaLight",
      "corner": [
        1.274999976158142,
        5.449999809265137,
        1.274999976158142
      ],
      "edge_u": [
        3.0,
        0.0,
        0.0
      ],
      "edge_v": [
        0.0,
        0.0,
        3.0
      ],
      "Le": [
        7.0,
        7.0,
        7.0
      ]
    }
  ]
}

out/proj2/req7_dielectric_showcase/proj2_req7_dielectric_showcase_mis_no_rr_20260628_144335/properties.md

### Calibração (rápida)

- **elapsed_seconds**: 0.823
- **samples_tested**: 8,192
- **rays_traced**: 0
- **intersection_tests**: 386,850
- **shadow_rays**: 0
- **measured_throughput**: 9956 caminhos/segundo

## Qualidade da Estimativa

- **Rays Model (estimado)**: 842.549s
- **Rays Model (real)**: 1013.442s
- **Rays Model (erro abs)**: 170.893s
- **Rays Model (erro rel)**: 16.863%
- **Rays Model (fator real/estimado)**: 1.20x
- **Rays Model (acurácia)**: 83.14%
- **Intersection Model (estimado)**: 178.420s
- **Intersection Model (real)**: 1013.442s
- **Intersection Model (erro abs)**: 835.022s
- **Intersection Model (erro rel)**: 82.395%
- **Intersection Model (fator real/estimado)**: 5.68x
- **Intersection Model (acurácia)**: 17.61%